constant,category,year,source,source_url,last_reviewed,review_frequency,status,blocking,notes
federal_brackets,Federal ordinary income tax,2025,IRS 2025 ordinary-income brackets embedded in src/taxes.py; verify against IRS annual inflation-adjustment revenue procedure,https://www.irs.gov/,2026-06-10,annual,CURRENT_WITHIN_POLICY,FALSE,"Annual process: after IRS releases the next-year inflation adjustment revenue procedure, update FEDERAL_BRACKETS_BASE_YEAR, FEDERAL_BRACKETS_VALUE_YEAR, schema bracket choices, workbook tests, and this dashboard."
standard_deduction,Federal deduction,2025,IRS 2025 standard deduction embedded in tax_constants.csv and src/taxes.py,https://www.irs.gov/,2026-06-10,annual,CURRENT_WITHIN_POLICY,FALSE,"Annual process: update tax_constants.csv, STANDARD_DEDUCTION_BASE_YEAR, over-65 additions, and closed-form tax tests."
irmaa_tiers,Medicare IRMAA,2025,CMS/Medicare 2025 IRMAA thresholds and surcharges embedded in src/taxes.py,https://www.cms.gov/,2026-06-10,annual,CURRENT_WITHIN_POLICY,FALSE,"Annual process: after CMS publishes new Medicare Part B/D premiums and IRMAA tables, update IRMAA_TIERS_BASE_YEAR, IRMAA_TIERS_VALUE_YEAR, UI tier labels, and Roth IRMAA tests."
ltcg_brackets,Long-term capital gains,2025,IRS 2025 long-term capital gain thresholds embedded in src/taxes.py,https://www.irs.gov/,2026-06-10,annual,CURRENT_WITHIN_POLICY,FALSE,"Annual process: update LTCG_BRACKETS_BASE_YEAR, source notes, and capital-gain tests."
ss_wage_base,Social Security wage base,2026,SSA 2026 wage base in tax_constants.csv,https://www.ssa.gov/,2026-07-01,annual,CURRENT_WITHIN_POLICY,FALSE,"Annual process: update ss_wage_base in tax_constants.csv and payroll tax tests."
rmd_divisors,Required minimum distributions,2022,IRS Uniform Lifetime Table effective 2022,https://www.irs.gov/,2026-06-10,annual,CURRENT_UNTIL_LAW_CHANGE,FALSE,"Annual process: confirm no statutory/table changes; update RMD divisor test fixtures if law changes."
state_tax,State income/estate assumptions,varies,reference_data/state_tax.csv sources per state,,2026-06-10,annual,REVIEW_REQUIRED_BY_STATE,TRUE,"Annual process: verify residence-state income, retirement-income, property, sales and estate-tax law before advisor-ready state-specific use."
capital_market_assumptions,Capital Markets,2026,reference_data/capital_market_assumptions.csv and asset_correlations.csv row-level refresh notes,,2026-06-09,annual,CURRENT_WITHIN_POLICY,FALSE,"Annual process (or sooner if market outlook materially changes): review expected return/volatility/correlation assumptions across all presets and horizons in capital_market_assumptions.csv and asset_correlations.csv, then update the refresh date in both this row and the CSV row-level notes."
